{
  "resourceType": "SubscriptionTopic",
  "url": "http://demo.org/topics/vitals",
  "version": "1.0.0",
  "title": "Vital signs (demo)",
  "description": "Final vital-sign observations (heart rate, blood pressure, temperature). Useful as a second Observation topic to show topic-level routing.",
  "status": "active",
  "resourceTrigger": [{
    "resource": "Observation",
    "supportedInteraction": ["create", "update"],
    "queryCriteria": {
      "current": "category=vital-signs&status=final"
    }
  }],
  "canFilterBy": [{
    "resource": "Observation",
    "filterParameter": "patient"
  }],
  "notificationShape": [{
    "resource": "Observation",
    "include": ["Observation:patient"]
  }]
}
